<?xml version="1.0" encoding="UTF-8"?>
<vehiculos xmlns:xsi="http://www.w3.org/2001/XMLSchema-instance" xsi:noNamespaceSchemaLocation="actividad2.xsd">
    <vehiculo>
        <nombre>Seat Ibiza</nombre>
        <modelo>1800 5 puertas</modelo>
        <datos_reparacion>
            <inicio>
                <dia>12</dia>
                <mes>Mayo</mes>
                <anyo>2018</anyo>
            </inicio>
            <fin>
                <dia>16</dia>
                <mes>mayo</mes>
                <anyo>2018</anyo>
            </fin>
        </datos_reparacion>
        <reparaciones>
            <reparacion>Cambio aceite</reparacion>
            <reparacion>Cambio de ruedas</reparacion>
            <reparacion>Revisi√≥n sistema frenado</reparacion>
            <reparacion>Pintar</reparacion>
        </reparaciones>
    </vehiculo>
</vehiculos>